id,topic,question,answer
1,Strength Training,How many times per week should I train?,"3–5 times a week is ideal for most people, depending on your goals and recovery."
2,Strength Training,What's the best rep range for strength?,3–6 reps with heavier weights builds strength.
3,Strength Training,Should I train abs every day?,No — abs are muscles too. 2–3 focused sessions per week are enough. Core is also trained during compound lifts.
4,Strength Training,What’s a push/pull/legs split?,"A training split where you do push exercises (chest, triceps), pull exercises (back, biceps), and legs on separate days."
5,Strength Training,How do resistance bands help with strength?,"Bands add variable resistance, making exercises harder as you stretch them. Great for joints, control, and portability."
6,Strength Training,What's the difference between machines and free weights?,"Machines are good for beginners and isolating muscles, while free weights work stabilizers and build functional strength."
7,Strength Training,Should I train to failure?,"Occasionally yes, but stopping 1–2 reps before failure most of the time helps with long-term progress and recovery."
8,Strength Training,What is progressive overload?,"Gradually increasing weight, reps, or sets over time to keep challenging your muscles."
9,Strength Training,How important is form versus weight?,Proper form is essential to avoid injury and ensure effective muscle engagement; weight should only be increased when form is maintained.
10,Strength Training,How do I warm up for strength training?,"Start with 5–10 minutes of light cardio, then dynamic stretches and a few warm-up sets of your first exercise."
11,Strength Training,What are compound lifts?,"Exercises that work multiple joints and muscles simultaneously, like squats, deadlifts, and bench presses."
12,Strength Training,Can I do cardio and strength on the same day?,"Yes, but ideally separate them to prioritize your main goal."
13,Strength Training,How do I build a strong back?,"Focus on exercises like rows, pull-ups, deadlifts, and scapular stabilization."
14,Strength Training,What are tempo reps?,"Controlling the speed of each rep (e.g., 3 seconds down, 1 second up) to increase muscle tension."
15,Strength Training,What is time under tension?,The total time your muscles are under load during a set; longer tension can stimulate muscle growth.
16,Strength Training,Should I train with resistance bands only?,"Yes, they can provide effective resistance and improve control, especially for home workouts."
17,Strength Training,What is a deload week?,A planned week of lighter training to allow recovery and prevent burnout.
18,Strength Training,How should I breathe during lifts?,Exhale during the exertion phase and inhale during the easier phase; avoid holding your breath.
19,Strength Training,Can I lose fat and build muscle simultaneously?,"It's possible, especially for beginners; focus on high protein, consistent training, and a slight calorie deficit."
20,Strength Training,How do I avoid plateaus in strength training?,"Vary your reps, sets, exercises, and intensity periodically."
21,Strength Training,What's the best way to finish a workout?,Cool down with light stretching and deep breathing to help your muscles recover.
22,Strength Training,How do I train calves effectively?,Include specific calf exercises to improve jump performance and balance.
23,Strength Training,Should I include isolation exercises?,"Yes, for targeted muscle growth, but compound lifts should be the foundation."
24,Strength Training,Is it better to train fast or slow?,"A mix works best: explosive movements for power and slow, controlled reps for muscle control."
25,Strength Training,Can bodyweight exercises replace weights?,"They’re effective for beginners, but adding weights increases intensity as you progress."
26,Strength Training,How do I increase grip strength?,"Use exercises like farmer's walks, dead hangs, and grip trainers."
27,Strength Training,What’s a superset?,Performing two exercises back-to-back with little to no rest to increase intensity and efficiency.
28,Strength Training,Can I use a split routine effectively?,"Yes, splitting workouts by muscle groups allows for recovery between sessions."
29,Strength Training,How do I know if I'm overtraining?,"Watch for signs like prolonged soreness, fatigue, and declining performance; recovery is key."
30,Strength Training,How can I incorporate recovery into my routine?,Include active recovery days and proper stretching to enhance muscle repair.
31,Diet & Nutrition,How much protein do I need?,Around 1.6–2.2g per kg of body weight per day if you’re active or strength training.
32,Diet & Nutrition,Do carbs make you fat?,"No — excess calories lead to fat gain, not carbs themselves."
33,Diet & Nutrition,What's the best post-workout meal?,"A mix of protein and carbs, such as grilled chicken with rice or a protein shake with a banana."
34,Diet & Nutrition,Is fruit bad because of sugar?,"No — fruit is rich in fiber, vitamins, and antioxidants. Natural sugars are healthy in moderation."
35,Diet & Nutrition,What's a good rule of thumb for building meals?,"Include one protein, one vegetable, one carbohydrate, and one healthy fat."
36,Diet & Nutrition,Should I eat before or after a workout?,A light carb-protein meal 1–2 hours before and a protein-focused meal afterward is ideal.
37,Diet & Nutrition,Should I count calories?,"It can help with weight management, but focus on nutrient-dense foods first."
38,Diet & Nutrition,What are healthy sources of fats?,"Avocados, olive oil, nuts, seeds, and fatty fish like salmon."
39,Diet & Nutrition,Are supplements necessary?,"They can help if your diet is lacking; consider whey protein, creatine, and vitamin D."
40,Diet & Nutrition,Can I eat the same meal every day?,"Yes, if it's balanced; variety is good, but consistency is key."
41,Diet & Nutrition,What's nutrient timing?,Adjusting when you eat certain foods around workouts for optimal energy and recovery.
42,Diet & Nutrition,Are cheat meals okay?,Yes — occasional indulgences won’t ruin progress as long as your overall diet is balanced.
43,Diet & Nutrition,How do I stay full while eating less?,Focus on high-fiber and high-protein foods and drink plenty of water.
44,Diet & Nutrition,What's the difference between simple and complex carbs?,"Simple carbs digest quickly, while complex carbs provide sustained energy."
45,Diet & Nutrition,How can I increase my calorie intake healthily?,"Opt for calorie-dense but nutritious foods like nuts, seeds, and whole grains."
46,Diet & Nutrition,Is it okay to train fasted?,"Some people do, but listen to your body; a small pre-workout snack can help."
47,Diet & Nutrition,How do I balance macronutrients?,"Adjust protein, carbs, and fats according to your goals; many find a balanced plate works well."
48,Diet & Nutrition,What are low-prep protein sources?,"Rotisserie chicken, canned tuna, pre-boiled eggs, and Greek yogurt."
49,Diet & Nutrition,How do I make salads more filling?,"Add lean proteins, healthy fats, and whole grains to boost satiety."
50,Diet & Nutrition,What are good pre-workout foods?,"A small snack combining carbs and protein, like a banana with peanut butter."
51,Diet & Nutrition,How do I avoid sugary drinks?,"Opt for water, herbal teas, or naturally flavored water with fruit slices."
52,Diet & Nutrition,Is intermittent fasting effective?,It works for some people; the best diet is the one you can stick with long-term.
53,Diet & Nutrition,What's mindful eating?,Eating slowly and without distractions to better recognize hunger and fullness cues.
54,Diet & Nutrition,How do I read nutrition labels?,"Focus on serving sizes, calories, and macronutrient breakdown to make informed choices."
55,Diet & Nutrition,Can I have dessert while staying healthy?,"Yes — moderation is key, and healthier alternatives can satisfy your sweet tooth."
56,Diet & Nutrition,How do I manage portion sizes?,Using smaller plates and being mindful of servings can help control calorie intake.
57,Diet & Nutrition,Is organic food better for me?,"Not necessarily more nutritious; focus on whole, minimally processed foods."
58,Diet & Nutrition,How do I meal plan effectively?,"Plan meals ahead, make a shopping list, and prep ingredients to simplify cooking."
59,Diet & Nutrition,What's the benefit of cooking at home?,"You control ingredients and portions, making it easier to maintain a balanced diet."
60,Diet & Nutrition,How do I adjust my diet for different training phases?,"Periodize your nutrition to support muscle gain, fat loss, or maintenance as needed."
61,Recovery & Sleep,How many hours of sleep do I need?,7–9 hours is ideal for most adults to ensure proper recovery.
62,Recovery & Sleep,Should I train when sore?,"Light activity can help, but don't push through sharp or persistent pain."
63,Recovery & Sleep,Can naps help with recovery?,Definitely — 20–30 minute naps can boost energy and performance.
64,Recovery & Sleep,What's sleep debt?,"Accumulated lost sleep over time; catch-up naps can help, but consistent sleep is best."
65,Recovery & Sleep,Should I sleep more when training hard?,Yes — intense training increases your body's need for recovery through sleep.
66,Recovery & Sleep,Can stretching before bed improve sleep?,Light stretching can relax muscles and help you wind down for better sleep.
67,Recovery & Sleep,How do I know if I'm overtraining?,"Signs include persistent fatigue, declining performance, and increased soreness."
68,Recovery & Sleep,Can foam rolling aid recovery?,Yes — foam rolling helps reduce muscle tightness and improve blood flow.
69,Recovery & Sleep,What's active recovery?,Engaging in light activities like walking or yoga to promote circulation without overexertion.
70,Recovery & Sleep,How does hydration affect recovery?,Staying well-hydrated aids in muscle repair and overall energy levels.
71,Recovery & Sleep,Is massage therapy beneficial?,"It can reduce muscle tension and improve circulation, aiding recovery."
72,Recovery & Sleep,Should I use ice or heat for muscle soreness?,Ice reduces inflammation while heat relaxes tight muscles; use as appropriate.
73,Recovery & Sleep,How important is a warm-up for recovery?,"A good warm-up increases blood flow and prepares muscles for exercise, reducing injury risk."
74,Recovery & Sleep,Can sleep tracking help improve recovery?,Yes — monitoring your sleep patterns can help you adjust your routine for better rest.
75,Recovery & Sleep,What role does nutrition play in recovery?,Proper nutrition provides the building blocks for muscle repair and energy replenishment.
76,Recovery & Sleep,How does stress impact sleep?,"High stress can disrupt sleep patterns, so managing stress is key to recovery."
77,Recovery & Sleep,Are sleep supplements useful?,"They can help occasionally, but focus on natural sleep habits first."
78,Recovery & Sleep,Can meditation aid sleep quality?,Yes — meditation can reduce stress and promote relaxation before bed.
79,Recovery & Sleep,How do I create a bedtime routine?,"Set a consistent schedule, dim the lights, avoid screens, and unwind with a calming activity."
80,Recovery & Sleep,Is it better to work out in the morning or evening?,It depends on your body clock; just ensure you allow enough time for recovery.
81,Recovery & Sleep,How often should I schedule recovery days?,"At least 1–2 days per week, or more if you're experiencing fatigue."
82,Recovery & Sleep,Can a hot bath help with muscle recovery?,Yes — a hot bath can relax muscles and improve circulation.
83,Recovery & Sleep,How do I balance training and recovery?,Listen to your body and adjust your workouts based on how you feel.
84,Recovery & Sleep,What’s the effect of alcohol on recovery?,Alcohol can impair muscle repair and disrupt sleep; moderation is key.
85,Recovery & Sleep,How does caffeine affect sleep?,Avoid caffeine late in the day as it can interfere with falling asleep.
86,Recovery & Sleep,What’s the benefit of sleep consistency?,Regular sleep times help regulate your body clock and improve sleep quality.
87,Recovery & Sleep,Can journaling before bed improve sleep?,Yes — writing down your thoughts can clear your mind and reduce stress.
88,Recovery & Sleep,How does air quality impact sleep?,Good air quality and a comfortable room temperature enhance sleep quality.
89,Recovery & Sleep,Are weighted blankets beneficial for sleep?,"They can provide comfort and reduce anxiety for some people, aiding sleep."
90,Recovery & Sleep,What simple changes can improve sleep quality?,"Establish a routine, limit screen time before bed, and create a calm sleep environment."
91,Motivation & Habits,How do I stay motivated to work out?,"Set small, achievable goals and track your progress over time."
92,Motivation & Habits,What's the best time to work out?,Choose a time that fits your schedule and stick to it for consistency.
93,Motivation & Habits,What's the 80/20 rule for fitness?,"80% of results come from 20% of your habits, like consistency and proper nutrition."
94,Motivation & Habits,Can I make progress with 10-minute workouts?,"Yes — even short, focused sessions add up over time."
95,Motivation & Habits,How do I train when life gets busy?,Have a quick fallback routine to keep the habit alive even on busy days.
96,Motivation & Habits,What's a non-scale victory?,"Improved energy, strength, mood, and better-fitting clothes are all non-scale victories."
97,Motivation & Habits,How do I stop comparing myself to others?,Focus on your progress and remember that every journey is unique.
98,Motivation & Habits,What if I miss a workout?,Don't stress — just get back on track the next day. Consistency matters over perfection.
99,Motivation & Habits,How do I build a fitness habit?,Start small and gradually increase your workouts until they become a regular part of your routine.
100,Motivation & Habits,Should I reward myself for workouts?,"Small rewards can boost motivation, but ensure they don't counteract your progress."
101,Motivation & Habits,How do I set realistic fitness goals?,"Set specific, measurable, and achievable goals that focus on progress rather than perfection."
102,Motivation & Habits,Can tracking my workouts help?,Yes — logging your exercises can help you see progress and stay motivated.
103,Motivation & Habits,What's a good mindset for long-term fitness?,Focus on progress over perfection and make fitness a lifestyle.
104,Motivation & Habits,How do I overcome a fitness plateau?,"Change up your routine, adjust intensity, or try a new activity to challenge your body."
105,Motivation & Habits,Can group workouts boost motivation?,Yes — exercising with others adds accountability and can make training more enjoyable.
106,Motivation & Habits,How do I manage fitness setbacks?,"Accept setbacks as part of the process, learn from them, and keep moving forward."
107,Motivation & Habits,What's the benefit of a workout buddy?,"A partner provides accountability, support, and can make workouts more fun."
108,Motivation & Habits,How do I stay committed to my routine?,Schedule your workouts like appointments and treat them as non-negotiable.
109,Motivation & Habits,Can positive affirmations help with fitness goals?,Yes — a positive mindset can improve performance and commitment.
110,Motivation & Habits,How do I incorporate mindfulness into my workouts?,Focus on your breathing and body sensations to enhance the exercise experience.
111,Motivation & Habits,What if I feel too tired to work out?,Sometimes rest is necessary; listen to your body and adjust your plan accordingly.
112,Motivation & Habits,How do I recover motivation after a break?,Ease back in with lighter workouts and celebrate small wins to rebuild momentum.
113,Motivation & Habits,What role does music play in motivation?,Upbeat music can boost energy and make workouts more enjoyable.
114,Motivation & Habits,How can I make exercise fun?,"Mix up your routine, try new activities, or join a class to keep things fresh."
115,Motivation & Habits,Should I track my progress with photos?,Yes — visual progress can be a powerful motivator.
116,Motivation & Habits,How do I deal with self-doubt in fitness?,Focus on your achievements and remind yourself that every step counts.
117,Motivation & Habits,Can a fitness app help keep me on track?,"Many apps offer tracking, reminders, and community support to boost consistency."
118,Motivation & Habits,How do I incorporate mindfulness into daily habits?,Small practices like deep breathing or a short walk can reset your mindset.
119,Motivation & Habits,What daily habit supports long-term fitness?,Consistent movement and a balanced approach to nutrition and exercise build lasting results.
120,Motivation & Habits,How can I use setbacks as motivation?,View challenges as opportunities to learn and come back stronger.
121,Food & Cooking Tips,How can I eat more protein without cooking a lot?,"Try Greek yogurt, rotisserie chicken, canned tuna, protein shakes, or hard-boiled eggs."
122,Food & Cooking Tips,How do I meal prep without stress?,"Plan meals ahead, choose a couple of proteins, carbs, and veggies, and mix them throughout the week."
123,Food & Cooking Tips,What's a quick breakfast for busy mornings?,"Overnight oats, a protein smoothie, or Greek yogurt with granola can be prepared in advance."
124,Food & Cooking Tips,How do I flavor water naturally?,"Add slices of lemon, mint, cucumber, or berries for a refreshing taste without extra calories."
125,Food & Cooking Tips,What's a good high-protein soup?,"Lentil soup, chicken and vegetable soup, or chili with beans and ground turkey are excellent choices."
126,Food & Cooking Tips,How do I make healthy snacks ahead of time?,"Prep boiled eggs, cut veggies with hummus, trail mix, or protein muffins in advance."
127,Food & Cooking Tips,How do I use leftovers creatively?,"Turn leftovers into wraps, salads, stir-fries, or grain bowls for variety."
128,Food & Cooking Tips,Can I use protein powder in cooking?,"Yes — add it to pancakes, muffins, oatmeal, or smoothies for an extra protein boost."
129,Food & Cooking Tips,How do I reduce food waste?,"Plan your meals, store leftovers properly, and repurpose ingredients into new recipes."
130,Food & Cooking Tips,What's a simple grocery list for fitness?,"Chicken, eggs, oats, spinach, bananas, rice, beans, Greek yogurt, olive oil, and frozen veggies."
131,Food & Cooking Tips,How can I make salads more satisfying?,"Add lean proteins, whole grains, and a variety of colorful vegetables for extra texture and flavor."
132,Food & Cooking Tips,What's a healthy dessert option?,"Fresh fruit, Greek yogurt with honey, or dark chocolate with nuts can satisfy your sweet cravings."
133,Food & Cooking Tips,How do I cook in bulk?,"Prepare large portions of proteins and grains, then portion them for the week."
134,Food & Cooking Tips,How do I add flavor without extra calories?,"Use herbs, spices, citrus juices, and vinegar to enhance the taste naturally."
135,Food & Cooking Tips,Can I enjoy carbs on a fitness diet?,Yes — choose complex carbs like whole grains and vegetables for sustained energy.
136,Food & Cooking Tips,How do I create balanced meals?,"Aim for a plate with half vegetables, a quarter protein, and a quarter carbohydrates."
137,Food & Cooking Tips,What are good sources of healthy fats?,"Avocado, olive oil, nuts, seeds, and fatty fish are excellent options."
138,Food & Cooking Tips,How do I manage portion sizes?,Use smaller plates and be mindful of serving sizes to prevent overeating.
139,Food & Cooking Tips,Is it important to vary my diet?,Yes — a variety of foods ensures you get a wide range of nutrients.
140,Food & Cooking Tips,What's the benefit of cooking at home?,"You have control over ingredients and portions, which helps in maintaining a balanced diet."
141,Food & Cooking Tips,How can I make a balanced snack?,"Combine protein, fiber, and healthy fats, like apple slices with nut butter."
142,Food & Cooking Tips,How do I prepare a quick lunch?,Salad bowls with lean protein or whole grain wraps with veggies are quick and nutritious.
143,Food & Cooking Tips,Can I enjoy fast food occasionally?,"In moderation, yes — opt for healthier choices when dining out."
144,Food & Cooking Tips,How do I save time in the kitchen?,Meal prep on weekends and use time-saving appliances like slow cookers or instant pots.
145,Food & Cooking Tips,What's a budget-friendly healthy meal?,"Beans and rice with spices, or a vegetable stir-fry with tofu, can be both nutritious and affordable."
146,Food & Cooking Tips,How do I plan meals for the week?,"Create a menu, make a shopping list, and prep ingredients ahead of time."
147,Food & Cooking Tips,What are simple recipes for beginners?,"Stir-fries, sheet-pan meals, and one-pot recipes are great for starting out."
148,Food & Cooking Tips,How do I adapt recipes for more protein?,"Add extra lean protein like chicken, beans, or tofu to boost nutritional value."
149,Food & Cooking Tips,How can I reduce sugar in my cooking?,Use natural sweeteners like fruit puree or a small amount of honey instead of refined sugar.
150,Food & Cooking Tips,What's a quick tip for healthier eating?,"Focus on whole, minimally processed foods and listen to your hunger cues."
151,Speed & Jump Training,How can I jump higher for volleyball?,"Train explosive leg exercises like jump squats, depth jumps, and box jumps 2–3 times per week."
152,Speed & Jump Training,What's the role of the core in jump power?,A strong core stabilizes your jump and controls landings; exercises like planks and deadbugs help.
153,Speed & Jump Training,Can I improve my jump with weights?,"Yes — exercises like squats, deadlifts, and hip thrusts build lower body strength for a higher jump."
154,Speed & Jump Training,How do I build quickness on the court?,"Incorporate reaction drills, lateral bounds, and short sprints with changes in direction."
155,Speed & Jump Training,How can I track my vertical jump progress?,Use a chalk mark on a wall or a smartphone app to measure your jump reach regularly.
156,Speed & Jump Training,Do resistance bands help with jump training?,"Yes — they add resistance to jump drills, improving power and speed during explosive movements."
157,Speed & Jump Training,What's a good warm-up for jump training?,"Dynamic drills like jump rope, high knees, and leg swings prepare your muscles for explosive movements."
158,Speed & Jump Training,How often should I do jump training?,2–3 times per week with proper rest days to avoid overtraining.
159,Speed & Jump Training,What exercises improve lateral movement?,"Side lunges, lateral bounds, and agility drills boost lateral quickness."
160,Speed & Jump Training,How important is sprint training for volleyball?,"Sprinting drills build speed and acceleration, which are crucial for quick court movements."
161,Speed & Jump Training,What role do plyometrics play in jump training?,Plyometrics enhance explosive power through rapid stretching and contracting of muscles.
162,Speed & Jump Training,Can I combine jump training with strength workouts?,Yes — integrating plyometric moves into strength sessions can improve overall power.
163,Speed & Jump Training,How can I improve my reaction time?,"Incorporate drills that require quick decision-making, such as partner or cone drills."
164,Speed & Jump Training,What is a depth jump?,"A jump performed after stepping off a box, focusing on quick, explosive upward movement."
165,Speed & Jump Training,How do I prevent injuries during jump training?,"Focus on proper landing techniques, warm up thoroughly, and use quality footwear."
166,Speed & Jump Training,What training frequency is best for speed?,Include short sprint intervals 2–3 times per week along with recovery days.
167,Speed & Jump Training,Can agility ladders help improve my speed?,Yes — they are excellent for developing foot speed and coordination.
168,Speed & Jump Training,How does flexibility impact jump performance?,"Improved flexibility can enhance your range of motion, contributing to better jump mechanics."
169,Speed & Jump Training,What's a good drill for improving vertical leap?,"Squat jumps and tuck jumps, focusing on explosive upward movement, are effective."
170,Speed & Jump Training,Can jump training help with endurance during games?,Yes — combining jump drills with conditioning helps maintain performance throughout matches.
171,Speed & Jump Training,What role does balance play in jump training?,Good balance ensures proper form and reduces injury risk during explosive movements.
172,Speed & Jump Training,How can I use resistance bands in plyometrics?,Wrap bands around your legs during jumps to add resistance and build power.
173,Speed & Jump Training,Should I train both legs equally?,Yes — balanced strength in both legs is essential for consistent jump performance.
174,Speed & Jump Training,What is the benefit of single-leg jumps?,"They help identify and correct imbalances between your legs, improving overall power."
175,Speed & Jump Training,How do I incorporate sprint drills effectively?,Alternate between short sprints and recovery periods to build acceleration and endurance.
176,Speed & Jump Training,Can jump training improve overall athletic performance?,Yes — enhanced explosive power benefits many aspects of athletic performance.
177,Speed & Jump Training,How do I know if I'm progressing in my jump training?,Track your vertical reach and monitor improvements in explosive drills over time.
178,Speed & Jump Training,What's the best time of day for jump training?,Train when you feel most energetic; consistency is more important than timing.
